{
  "schema_version": "1.0",
  "generated_at": "2026-04-24T12:00:00Z",
  "project": {
    "name": "sandbox-cli-tool",
    "summary": "E2E テスト用の fixture プロジェクト。日常的なファイル整理を自動化する CLI ツールを想定",
    "languages": ["python"],
    "root_kind": ["cli"]
  },
  "archetype_primary": "daily-utility",
  "archetype_scores": {
    "daily-utility": 0.72,
    "library-package": 0.05,
    "production-saas": 0.12,
    "mobile-app": 0.02,
    "ml-data": 0.06,
    "infra-iac": 0.03
  },
  "workflow": {
    "plan_work_review": false,
    "precommit_strictness": "lint-only",
    "long_running_agents": false
  },
  "quality_gates": {
    "required_checks": ["lint", "format"],
    "ci_external": false
  },
  "review": {
    "ai_second_opinion": false,
    "specialized_reviewers": []
  },
  "safety": {
    "handles_secrets": false,
    "destructive_ops": []
  },
  "meta": {
    "locale": "ja",
    "existing_claude_dir": false,
    "intents": [
      "一度に1機能だけ実装する",
      "commit 前に必ず lint を通す",
      "ファイル移動前に dry-run で対象を確認"
    ]
  },
  "overrides": {
    "exclude_subagents": [],
    "force_include_hooks": []
  }
}
