{
  "schema_version": "1.0",
  "generated_at": "2026-04-25T12:00:00Z",
  "project": {
    "name": "sandbox-multi-platform",
    "summary": "React Native + iOS + Android の3プラットフォームを同時運用するアプリ",
    "languages": ["typescript", "swift", "kotlin"],
    "root_kind": ["mobile"],
    "mobile_platforms": ["react-native", "ios", "android"],
    "design_focus": true
  },
  "archetype_primary": "mobile-app",
  "archetype_scores": {
    "daily-utility": 0.05,
    "library-package": 0.00,
    "production-saas": 0.08,
    "mobile-app": 0.80,
    "ml-data": 0.00,
    "infra-iac": 0.07
  },
  "workflow": {
    "plan_work_review": true,
    "precommit_strictness": "lint-test",
    "long_running_agents": false
  },
  "quality_gates": {
    "required_checks": ["lint", "format", "typecheck", "unit-test", "visual-regression"],
    "ci_external": true
  },
  "review": {
    "ai_second_opinion": true,
    "specialized_reviewers": ["code", "ui", "a11y"]
  },
  "safety": {
    "handles_secrets": true,
    "destructive_ops": []
  },
  "meta": {
    "locale": "ja",
    "existing_claude_dir": false,
    "intents": [
      "iOS/Android 両方の manifest を同期させる",
      "native module bridge の async 漏れを防ぐ",
      "UI 変更は必ず両 platform の Simulator/Emulator で確認"
    ]
  },
  "overrides": {
    "exclude_subagents": [],
    "force_include_hooks": []
  }
}
