{
  "schema_version": "1.0",
  "generated_at": "2026-04-25T12:00:00Z",
  "project": {
    "name": "sandbox-ios-app",
    "summary": "E2E テスト用 iOS アプリ fixture。SwiftUI で画像整理 CLI ラッパーを想定",
    "languages": ["swift"],
    "root_kind": ["mobile"],
    "mobile_platforms": ["ios"],
    "design_focus": false
  },
  "archetype_primary": "mobile-app",
  "archetype_scores": {
    "daily-utility": 0.05,
    "library-package": 0.00,
    "production-saas": 0.03,
    "mobile-app": 0.85,
    "ml-data": 0.00,
    "infra-iac": 0.07
  },
  "workflow": {
    "plan_work_review": true,
    "precommit_strictness": "lint-test",
    "long_running_agents": false
  },
  "quality_gates": {
    "required_checks": ["lint", "format", "unit-test", "integration-test"],
    "ci_external": true
  },
  "review": {
    "ai_second_opinion": true,
    "specialized_reviewers": ["code", "a11y"]
  },
  "safety": {
    "handles_secrets": true,
    "destructive_ops": []
  },
  "meta": {
    "locale": "ja",
    "existing_claude_dir": false,
    "intents": [
      "Info.plist と Bundle Identifier を誤って変更しない",
      "証明書と provisioning profile を絶対に commit しない",
      "UI 変更時は Simulator で確認してから commit"
    ]
  },
  "overrides": {
    "exclude_subagents": [],
    "force_include_hooks": []
  }
}
