{
  "schema_version": "1.0",
  "generated_at": "2026-04-25T12:00:00Z",
  "project": {
    "name": "sandbox-ml-pipeline",
    "summary": "E2E テスト用 ML パイプライン fixture。Jupyter + pytest + DVC を想定",
    "languages": ["python"],
    "root_kind": ["notebook"],
    "design_focus": false
  },
  "archetype_primary": "ml-data",
  "archetype_scores": {
    "daily-utility": 0.05,
    "library-package": 0.00,
    "production-saas": 0.05,
    "mobile-app": 0.00,
    "ml-data": 0.85,
    "infra-iac": 0.05
  },
  "workflow": {
    "plan_work_review": true,
    "precommit_strictness": "lint-test",
    "long_running_agents": false
  },
  "quality_gates": {
    "required_checks": ["lint", "format", "unit-test", "integration-test"],
    "ci_external": true
  },
  "review": {
    "ai_second_opinion": true,
    "specialized_reviewers": ["code"]
  },
  "safety": {
    "handles_secrets": true,
    "destructive_ops": []
  },
  "meta": {
    "locale": "ja",
    "existing_claude_dir": false,
    "intents": [
      "random seed を必ず固定",
      "50MB 超のデータ・モデルは DVC で管理",
      "notebook の output を残したまま commit しない"
    ]
  },
  "overrides": {
    "exclude_subagents": [],
    "force_include_hooks": []
  }
}
