{
  "schema_version": "1.0",
  "generated_at": "2026-04-25T12:00:00Z",
  "project": {
    "name": "sandbox-nextjs-saas",
    "summary": "E2E テスト用 Next.js + Supabase + Stripe SaaS fixture",
    "languages": ["typescript"],
    "root_kind": ["web"],
    "design_focus": false
  },
  "archetype_primary": "production-saas",
  "archetype_scores": {
    "daily-utility": 0.05,
    "library-package": 0.00,
    "production-saas": 0.85,
    "mobile-app": 0.00,
    "ml-data": 0.00,
    "infra-iac": 0.10
  },
  "workflow": {
    "plan_work_review": true,
    "precommit_strictness": "full",
    "long_running_agents": false
  },
  "quality_gates": {
    "required_checks": ["lint", "format", "typecheck", "unit-test", "integration-test", "security-scan"],
    "ci_external": false
  },
  "review": {
    "ai_second_opinion": true,
    "specialized_reviewers": ["code", "security"]
  },
  "safety": {
    "handles_secrets": true,
    "destructive_ops": ["deploy", "db-migrate", "force-push"]
  },
  "meta": {
    "locale": "ja",
    "existing_claude_dir": false,
    "intents": [
      "認証・決済まわりは security-reviewer 必須",
      "lint config を緩めて回避しない",
      "PR 作成前に必ず typecheck + test を通す"
    ]
  },
  "overrides": {
    "exclude_subagents": [],
    "force_include_hooks": []
  }
}
